Grant Name,Sponsor,Link,Open Date,Deadline,Status
"National Defense Education Program (NDEP) Science, Technology, Engineering, and Mathematics (STEM) Consortia Request for Information (RFI) for the Office of the Under Secretary of Defense (Research &amp; Engineering)",Department of Defense,https://www.grants.gov/search-results-detail/334905,07/27/2021,,forecasted
STARBASE Wright Patt,Air Force -- Research Lab,https://www.grants.gov/search-results-detail/329806,11/13/2020,,forecasted
American Prosperity:  Foreign Investment Readiness Program,U.S. Mission to Jordan,https://www.grants.gov/search-results-detail/360185,07/31/2025,09/01/2025,posted
NSF Small Business Innovation Research / Small Business Technology Transfer Fast-Track Pilot Programs,U.S. National Science Foundation,https://www.grants.gov/search-results-detail/355009,06/18/2024,11/05/2025,posted
Academy for Women Entrepreneurs 2024,U.S. Mission to Zimbabwe,https://www.grants.gov/search-results-detail/350892,11/07/2023,,forecasted
"NHLBI SBIR Phase IIB Small Market Awards to Accelerate the Commercialization of Technologies for Heart, Lung, Blood, and Sleep Disorders and Diseases (R44 Clinical Trial Optional)",National Institutes of Health,https://www.grants.gov/search-results-detail/357231,11/18/2024,02/26/2027,posted
Small Business Innovation Research and Small Business Technology Transfer Programs Phase II,National Institute of Food and Agriculture,https://www.grants.gov/search-results-detail/360040,07/16/2025,09/23/2025,posted
Small Business Transition Grant for New Entrepreneurs (R43/R44 Clinical Trial Required),National Institutes of Health,https://www.grants.gov/search-results-detail/353826,04/26/2024,04/05/2027,posted
Small Business Transition Grant for New Entrepreneurs (R41/R42 Clinical Trial Not Allowed),National Institutes of Health,https://www.grants.gov/search-results-detail/353801,04/25/2024,04/05/2027,posted
Small Business Transition Grant for New Entrepreneurs (R41/R42 Clinical Trial Required),National Institutes of Health,https://www.grants.gov/search-results-detail/353803,04/25/2024,04/05/2027,posted
Small Business Transition Grant for New Entrepreneurs (R43/R44 Clinical Trial Not Allowed),National Institutes of Health,https://www.grants.gov/search-results-detail/353791,04/25/2024,04/05/2027,posted
NSF Small Business Innovation Research / Small Business Technology Transfer Phase I Programs,U.S. National Science Foundation,https://www.grants.gov/search-results-detail/354632,05/31/2024,11/05/2025,posted
NSF Small Business Innovation Research  / Small Business Technology Transfer Phase II Programs,U.S. National Science Foundation,https://www.grants.gov/search-results-detail/354633,05/31/2024,11/05/2025,posted
Dairy Business Innovation Initiatives Program (DBI) Fiscal Year 2025,Agricultural Marketing Service,https://www.grants.gov/search-results-detail/360013,07/14/2025,09/09/2025,posted
Supplemental Opportunity for SBIR/STTR Memberships in I/UCRCs,U.S. National Science Foundation,https://www.grants.gov/search-results-detail/50283,11/18/2009,,posted
EONS 2018: Appendix E Minority University Research and Education Project (MUREP) for Sustainability and Innovation Collaborative &ndash; (MUSIC) ,National Aeronautics and Space Administration,https://www.grants.gov/search-results-detail/300997,02/22/2018,,posted
U.S. Embassy Praia Ambassador&rsquo;s Special Self-Help (SSH) Program,U.S. Mission to Cape Verde,https://www.grants.gov/search-results-detail/325599,03/19/2020,,posted
"NSF Scholarships in Science, Technology, Engineering, and Mathematics Program",U.S. National Science Foundation,https://www.grants.gov/search-results-detail/357498,12/03/2024,03/03/2026,posted
"NIH, CDC and FDA Small Business Innovation Research Grant (Parent SBIR [R43/R44] Clinical Trial Not Allowed)",National Institutes of Health,https://www.grants.gov/search-results-detail/359671,06/18/2025,,forecasted
NIH Small Business Technology Transfer Grant (Parent STTR [R41/R42] Clinical Trial Not Allowed),National Institutes of Health,https://www.grants.gov/search-results-detail/359757,06/18/2025,,forecasted
NIH and CDC Small Business Innovation Research Grant (Parent SBIR [R43/R44] Clinical Trial Required),National Institutes of Health,https://www.grants.gov/search-results-detail/359758,06/18/2025,,forecasted
NIH Small Business Technology Transfer Grant (Parent STTR [R41/R42] Clinical Trial Required),National Institutes of Health,https://www.grants.gov/search-results-detail/359670,06/10/2025,,forecasted
NINDS Exploratory Clinical Trials for Small Business (R41/R42 Clinical Trial Required),National Institutes of Health,https://www.grants.gov/search-results-detail/351150,11/27/2023,09/05/2026,posted
NINDS Exploratory Clinical Trials for Small Business (R43/R44 Clinical Trial Required),National Institutes of Health,https://www.grants.gov/search-results-detail/351149,11/27/2023,09/05/2026,posted
NRL Long Range Broad Agency Announcement (BAA) for Basic and Applied Research,Naval Research Laboratory,https://www.grants.gov/search-results-detail/352741,03/01/2024,09/30/2025,posted
Promote Transparency by Enhancing Citizens&rsquo; Access to Information on Public Revenues.,U.S. Mission to Mauritania,https://www.grants.gov/search-results-detail/360246,08/06/2025,09/08/2025,posted
Annual Program Statement (APS) for Fiscal Year 2025,U.S. Mission to Tunisia,https://www.grants.gov/search-results-detail/359120,06/02/2025,,forecasted
Research and Development (RAD) Directed Energy (RD) University Assistance Instruments,Air Force -- Research Lab,https://www.grants.gov/search-results-detail/355499,07/18/2024,07/18/2029,posted
Naval Engineering Education Consortium (NEEC) Broad Agency Announcement for Fiscal Year 2026,NSWC Dahlgren,https://www.grants.gov/search-results-detail/360183,07/30/2025,,forecasted
U.S. Embassy Buenos Aires PAS Strategic Programs,U.S. Mission to Argentina,https://www.grants.gov/search-results-detail/358695,04/17/2025,,forecasted
Innovations for Healthy Living - Improving Minority Health and Eliminating Health Disparities (R43/R44 - Clinical Trial Optional),National Institutes of Health,https://www.grants.gov/search-results-detail/352882,03/08/2024,12/09/2026,posted
Technologies for Improving Minority Health and Eliminating Health Disparities (R41/R42- Clinical Trial Optional),National Institutes of Health,https://www.grants.gov/search-results-detail/352883,03/08/2024,12/09/2026,posted
"SBIR/STTR Commercialization Readiness Pilot (CRP) Program Technical Assistance and Late Stage Development (SB1, Clinical Trial Not Allowed)",National Institutes of Health,https://www.grants.gov/search-results-detail/349231,07/12/2023,09/05/2025,posted
SBIR/STTR Commercialization Readiness Pilot (CRP) Program Technical Assistance and Late Stage Development (SB1 Clinical Trial Required),National Institutes of Health,https://www.grants.gov/search-results-detail/349235,07/12/2023,09/05/2025,posted
Community Economic Development Projects,Administration for Children and Families - OCS,https://www.grants.gov/search-results-detail/355604,07/24/2024,,forecasted
NIAID SBIR Phase II Clinical Trial Implementation Cooperative Agreement (U44 Clinical Trial Required),National Institutes of Health,https://www.grants.gov/search-results-detail/352061,01/29/2024,01/13/2027,posted
U.S. Embassy Djibouti PDS Annual Program Statement,U.S. Mission to Djibouti,https://www.grants.gov/search-results-detail/352290,02/11/2024,,forecasted
"NHLBI SBIR Phase IIB Bridge Awards to Accelerate the Commercialization of Technologies for Heart, Lung, Blood, and Sleep Disorders and Diseases (R44 Clinical Trial Optional)",National Institutes of Health,https://www.grants.gov/search-results-detail/357230,11/18/2024,02/26/2027,posted
Forecast to Publish a Notice of Funding Opportunity for SBIR Phase IIB Bridge Awards to Accelerate the Development of Cancer-Relevant Technologies Toward Commercialization (R44 Clinical Trial Optional),National Institutes of Health,https://www.grants.gov/search-results-detail/359726,06/16/2025,,forecasted
U.S. Embassy Lusaka Public Diplomacy Section Annual Program Statement,U.S. Mission to Zambia,https://www.grants.gov/search-results-detail/358884,05/10/2025,,forecasted
NIEHS Worker Training Program&rsquo;s SBIR E-Learning for HAZMAT and Emergency Response (R43/R44 Clinical Trial Not Allowed),National Institutes of Health,https://www.grants.gov/search-results-detail/358912,05/21/2025,,forecasted
SBIR/STTR Commercialization Readiness Pilot (CRP) Program (Parent SB1 Clinical Trial Required),National Institutes of Health,https://www.grants.gov/search-results-detail/359668,06/18/2025,,forecasted
SBIR/STTR Commercialization Readiness Pilot (CRP) Program (Parent SB1 Clinical Trial Not Allowed),National Institutes of Health,https://www.grants.gov/search-results-detail/359669,06/10/2025,,forecasted
Science of Organizations,U.S. National Science Foundation,https://www.grants.gov/search-results-detail/112354,08/08/2011,,posted
Pathways to Enable Open-Source Ecosystems,U.S. National Science Foundation,https://www.grants.gov/search-results-detail/356423,09/14/2024,09/02/2025,posted
NINDS Renewal Awards of SBIR Phase II Grants (Phase IIB) for Clinical Trials and Clinical Research (R44 Clinical Trial Optional),National Institutes of Health,https://www.grants.gov/search-results-detail/355039,06/20/2024,04/05/2027,posted
Alumni Engagement Innovation Fund 2024,U.S. Mission to Latvia,https://www.grants.gov/search-results-detail/350831,11/02/2023,,forecasted
Test Bed: Toward a Network of Programmable Cloud Laboratories,U.S. National Science Foundation,https://www.grants.gov/search-results-detail/360244,08/05/2025,11/20/2025,posted
"PHS 2024-2 Omnibus Solicitation of the NIH, CDC and FDA for Small Business Innovation Research Grant Applications (Parent SBIR [R43/R44] Clinical Trial Not Allowed)",National Institutes of Health,https://www.grants.gov/search-results-detail/355265,07/03/2024,09/05/2025,posted
PHS 2024-2 Omnibus Solicitation of the NIH for Small Business Technology Transfer Grant Applications (Parent STTR [R41/R42] Clinical Trial Not Allowed),National Institutes of Health,https://www.grants.gov/search-results-detail/355259,07/03/2024,09/05/2025,posted
PHS 2024-2 Omnibus Solicitation of the NIH and CDC for Small Business Innovation Research Grant Applications (Parent SBIR [R43/R44] Clinical Trial Required),National Institutes of Health,https://www.grants.gov/search-results-detail/355264,07/03/2024,09/05/2025,posted
PHS 2024-2 Omnibus Solicitation of the NIH for Small Business Technology Transfer Grant Applications (Parent STTR [R41/R42] Clinical Trial Required),National Institutes of Health,https://www.grants.gov/search-results-detail/355260,07/03/2024,09/05/2025,posted
Small Business Translator: MedTech and Digital Health Technologies,National Institutes of Health,https://www.grants.gov/search-results-detail/359156,05/28/2025,,forecasted
Forecast to Publish a Notice of Funding Opportunity for Small Business Transition Grant For Early Career Scientists (R41/R42 Clinical Trial Not Allowed),National Institutes of Health,https://www.grants.gov/search-results-detail/359724,06/16/2025,,forecasted
NEI Small Business Innovation Research (SBIR) Cooperative Agreement for Early-Stage Clinical Trials with Greater than Minimal Risk (U44-Clinical Trial Required),National Institutes of Health,https://www.grants.gov/search-results-detail/351266,12/01/2023,01/07/2027,posted
NeuroNEXT Small Business Innovation in Clinical Trials (U44 Clinical Trial Optional),National Institutes of Health,https://www.grants.gov/search-results-detail/357073,11/12/2024,09/05/2027,posted
NIST MEP Disaster Assessment Program,National Institute of Standards and Technology,https://www.grants.gov/search-results-detail/323740,01/17/2020,,posted
U.S. Embassy Cotonou PDS Request for Statements of Interest,U.S. Mission to Benin,https://www.grants.gov/search-results-detail/358808,05/02/2025,,forecasted
Fiscal Year (FY) 2026 Department of Defense Multidisciplinary Research Program of the University Research Initiative (MURI),Air Force Office of Scientific Research,https://www.grants.gov/search-results-detail/358533,03/05/2025,09/05/2025,posted
Embassy Belgrade PAS - University Partnership,U.S. Mission to Serbia,https://www.grants.gov/search-results-detail/327658,06/12/2020,,forecasted
U.S. Mission T&uuml;rkiye Public Diplomacy Grants Program,Bureau of European and Eurasian Affairs,https://www.grants.gov/search-results-detail/358883,05/12/2025,,forecasted
FY 2026 International Visitor Leadership Program&rsquo;s National Program Agencies,Bureau Of Educational and Cultural Affairs,https://www.grants.gov/search-results-detail/359957,07/09/2025,09/08/2025,posted
Request for Information &ndash; University Partnership Models,Dept of the Army -- Materiel Command,https://www.grants.gov/search-results-detail/356837,10/24/2024,,forecasted
FY 2026 International Visitor Leadership Program Collaborative Services,Bureau Of Educational and Cultural Affairs,https://www.grants.gov/search-results-detail/359958,07/09/2025,09/08/2025,posted
Request For Information - Slip-On Tankers,Interior Business Center,https://www.grants.gov/search-results-detail/350138,09/07/2023,,forecasted
Advancing Research on Alzheimer's Disease (AD) and AD-Related Dementias (ADRD) (R41/R42 Clinical Trial Optional),National Institutes of Health,https://www.grants.gov/search-results-detail/341325,06/21/2022,09/05/2025,posted
Mission Spain Public Diplomacy 2022 Annual Program Statement,U.S. Mission to Spain,https://www.grants.gov/search-results-detail/336244,11/02/2021,,posted
Innovation Corps Teams (I-CorpsTM* Teams)  Program,U.S. National Science Foundation,https://www.grants.gov/search-results-detail/330934,01/15/2021,,posted
Advancing Research on Alzheimer's Disease (AD) and AD-Related Dementias (ADRD) (R43/R44 Clinical Trial Optional),National Institutes of Health,https://www.grants.gov/search-results-detail/341289,06/21/2022,09/05/2025,posted
U.S. Embassy Luanda Public Diplomacy Section Request for a Full Proposal Application,U.S. Mission to Angola,https://www.grants.gov/search-results-detail/358783,04/30/2025,,forecasted
STARBASE Cherry Point,NAVAIR,https://www.grants.gov/search-results-detail/358672,04/16/2025,,forecasted
Using Archived Data and Specimen Collections to Advance Maternal and Pediatric HIV/AIDS Research,National Institutes of Health,https://www.grants.gov/search-results-detail/359945,07/08/2025,,forecasted
Advancing Prevention and Treatment of Bacterial STIs in HIV-affected Adolescent and Maternal Populations,National Institutes of Health,https://www.grants.gov/search-results-detail/359948,07/08/2025,,forecasted
Novel Experiential Technologies Assisting Individual Learning (NExT AI) Hubs,National Institutes of Health,https://www.grants.gov/search-results-detail/359949,07/08/2025,,forecasted
National Science Foundation Translation to Practice,U.S. National Science Foundation,https://www.grants.gov/search-results-detail/359966,07/09/2025,09/16/2025,posted
HEAL Commercialization Readiness Pilot (CRP) Program: Embedded Entrepreneurs for Small Businesses in Pain Management (SB1 Clinical Trial Not Allowed),National Institutes of Health,https://www.grants.gov/search-results-detail/345222,01/03/2023,09/05/2025,posted
Seeking Products to Address Social Needs impacting Substance Use Disorders (SUD) (R41/R42 Clinical Trial Optional),National Institutes of Health,https://www.grants.gov/search-results-detail/350387,09/28/2023,03/13/2026,posted
Miniaturization and Automation of Tissue Chip Systems (MATChS) (U43/U44 Clinical Trial Not Allowed),National Institutes of Health,https://www.grants.gov/search-results-detail/351096,11/21/2023,02/23/2026,posted
Seeking Products to Address Social Needs impacting Substance Use Disorders (SUD) (R43/R44 Clinical Trial Optional),National Institutes of Health,https://www.grants.gov/search-results-detail/350388,09/28/2023,03/13/2026,posted
Miniaturization and Automation of Tissue Chip Systems (MATChS) (UT1/UT2 - Clinical Trial Not Allowed),National Institutes of Health,https://www.grants.gov/search-results-detail/351095,11/21/2023,02/23/2026,posted
Annual Engagement Innovation Fund Italy,U.S. Mission to Italy,https://www.grants.gov/search-results-detail/351555,12/19/2023,,forecasted
"Mission Spain Public Diplomacy NOFO Defensa y Yo 5.0, 2024-2025",U.S. Mission to Spain,https://www.grants.gov/search-results-detail/355385,07/23/2024,,forecasted
Sociology,U.S. National Science Foundation,https://www.grants.gov/search-results-detail/45810,03/06/2009,,posted
"Pioneering Aerospace Capabilities, Engineering and Research (PACER)",Air Force -- Research Lab,https://www.grants.gov/search-results-detail/349554,07/26/2023,05/10/2043,posted
CHEERS Open Period 2 - All Technical Areas,Air Force -- Research Lab,https://www.grants.gov/search-results-detail/360262,08/07/2025,09/30/2027,posted
CHEERS Open Period 1 - All Technical Areas,Air Force -- Research Lab,https://www.grants.gov/search-results-detail/360261,08/07/2025,09/30/2027,posted
Defense Production Act Title III Expansion of Domestic Production Capability and Capacity,Air Force -- Research Lab,https://www.grants.gov/search-results-detail/318351,07/12/2019,07/12/2026,posted
MAGNETIC ACCELERATION GENERATING NEW INNOVATIONS AND TACTICAL OUTCOMES SBIR/STTR (MAGNITO SBIR/STTR),Advanced Research Projects Agency Energy ,https://www.grants.gov/search-results-detail/360356,08/25/2025,09/24/2025,posted
Reliable Ore Characterization with Keystone Sensing SBIR/STTR (ROCKS SBIR/STTR),Advanced Research Projects Agency Energy ,https://www.grants.gov/search-results-detail/360354,08/25/2025,09/25/2025,posted
Partnerships with MCC Program,Millennium Challenge Corporation,https://www.grants.gov/search-results-detail/314279,03/26/2019,03/31/2027,posted
FY25 Naval Air Warfare Center Aircraft Division Office-Wide Broad Agency Announcement,NAVAIR,https://www.grants.gov/search-results-detail/359802,06/27/2025,06/22/2026,posted
Bipartisan Infrastructure Law - Carbon Dioxide Transportation Infrastructure Finance and Innovation (CIFIA) Program: Future Growth Grants (Section 40304),National Energy Technology Laboratory,https://www.grants.gov/search-results-detail/353946,05/02/2024,01/02/2026,posted
UNITED STATES MILITARY ACADEMY Broad Agency Announcement,Dept of the Army -- Materiel Command,https://www.grants.gov/search-results-detail/325932,04/01/2020,03/31/2027,posted
DEVCOM ANALYSIS CENTER BROAD AGENCY ANNOUNCEMENT FOR APPLIED RESEARCH,Dept of the Army -- Materiel Command,https://www.grants.gov/search-results-detail/345241,01/05/2023,01/04/2028,posted
Microsystems Technology Office (MTO) Office-wide,DARPA - Microsystems Technology Office ,https://www.grants.gov/search-results-detail/354134,05/09/2024,10/09/2025,posted
FY25 Long Range Broad Agency Announcement (BAA) for Navy and Marine Corps Science and Technology,Office of Naval Research,https://www.grants.gov/search-results-detail/356605,10/01/2024,09/30/2025,posted
BROAD AGENCY ANNOUNCEMENT (BAA) for Extramural Biomedical and Human Performance Research and Development Department of Defense,Dept. of the Army -- USAMRAA,https://www.grants.gov/search-results-detail/349586,07/27/2023,07/31/2028,posted
ARMY APPLICATIONS LAB BROAD AGENCY ANNOUNCEMENT FOR DISRUPTIVE APPLICATIONS,Dept of the Army -- Materiel Command,https://www.grants.gov/search-results-detail/355150,06/26/2024,04/04/2029,posted
Biological Technologies,DARPA - Biological Technologies Office,https://www.grants.gov/search-results-detail/356403,09/11/2024,09/10/2025,posted
Defense Sciences Office (DSO) Office-wide BAA,DARPA - Defense Sciences Office,https://www.grants.gov/search-results-detail/359239,06/03/2025,06/02/2026,posted
